BOM Final.csv

Part name,,Quantity,Value,LCSC # / Link,,,,,,,,,
Electronics,,,,,,,,,,,,,
Index,LCSC#,MPN,Manufacturer,Package,Customer #,Description,RoHS,Quantity,MOQ,Multiple,Unit Price($),Extended Price($),Product Link
1,C146170,RKJXV1224005,ALPSALPINE,"Through Hole,13x13mm",,"Through Hole,13x13mm Navigation Switches, Joystick RoHS",yes,2,1,1,0.9044,1.81,https://www.lcsc.com/product-detail/C146170.html
2,C22396880,LCKFB-DKX-STM32F103C8T6,LCSC-boards,-,,"Embedded MCU, DSP Evaluation Boards RoHS",yes,6,1,1,1.7239,10.34,https://www.lcsc.com/product-detail/C22396880.html
3,C49678,CC0805KRX7R9BB104,YAGEO,805,,100nF ±10% 50V Ceramic Capacitor X7R 0805,yes,100,100,100,0.0084,0.84,https://www.lcsc.com/product-detail/C49678.html
4,C72487,RVT1H100M0505,ROQANG,"SMD,D5xL5.4mm",,10uF ±20% 50V Aluminum Electrolytic Capacitors 2000hrs@105℃,yes,20,20,20,0.0284,0.57,https://www.lcsc.com/product-detail/C72487.html
5,C24123,CL21B105KOFNNNE,Samsung Electro-Mechanics,805,,1uF ±10% 16V Ceramic Capacitor X7R 0805,yes,20,20,20,0.015,0.3,https://www.lcsc.com/product-detail/C24123.html
6,C3869051,AC0805KKX7R5BB105,YAGEO,805,,1uF ±10% 6.3V Ceramic Capacitor X7R 0805,yes,20,20,20,0.0285,0.57,https://www.lcsc.com/product-detail/C3869051.html
7,C8465,WJ500V-5.08-2P,KANGNEX,"Through Hole,P=5.08mm",,2 Position Wire to Board Terminal Block Through Hole 5.08mm,yes,5,5,5,0.1336,0.67,https://www.lcsc.com/product-detail/C8465.html
8,C72334,WJ500V-5.08-03P-14-00A,KANGNEX,"Through Hole,P=5.08mm",,3 Position Wire to Board Terminal Block Through Hole 5.08mm,yes,5,5,5,0.202,1.01,https://www.lcsc.com/product-detail/C72334.html
9,C86513,CSD18540Q5B,TI,VSON-8(5x6),,N-Channel 60V 205A 3.8W Surface Mount VSON-8(5x6),yes,4,1,1,1.6973,6.79,https://www.lcsc.com/product-detail/C86513.html
10,C114548,RC0805FR-0768KL,YAGEO,805,,68kΩ 125mW 150V Thick Film Resistor ±100ppm/℃ ±1% 0805 Chip Resistor - Surface Mount RoHS,yes,100,100,100,0.0036,0.36,https://www.lcsc.com/product-detail/C114548.html
11,C2930231,FRC0805J103TS,FOJAN,805,,10kΩ ±5% 125mW 0805 Thick Film Resistor,yes,100,100,100,0.0019,0.19,https://www.lcsc.com/product-detail/C2930231.html
12,C90964,DRV8701ERGER,TI,VQFN-24-EP(4x4),,"Full-Bridge MOSFET 150mA 300mA VQFN-24-EP(4x4) Motor Drivers, Controllers RoHS",yes,5,1,1,0.7397,3.7,https://www.lcsc.com/product-detail/C90964.html
13,C58159,3362P-1-103LF,BOURNS,"Through Hole-3P,7x6.6mm",,"10kΩ ±10% 500mW Through Hole-3P,7x6.6mm Potentiometers, Variable Resistors",yes,1,1,1,0.3763,0.38,https://www.lcsc.com/product-detail/C58159.html
14,C7467397,FRL0805FR030TS,FOJAN,805,,30mΩ 125mW Thick Film Resistor ±1200ppm/℃ ±1% 0805 Chip Resistor - Surface Mount RoHS,yes,50,50,50,0.013,0.65,https://www.lcsc.com/product-detail/C7467397.html
15,C2930266,FRC0805J332TS,FOJAN,805,,3.3kΩ ±5% 125mW 0805 Thick Film Resistor,yes,100,100,100,0.0019,0.19,https://www.lcsc.com/product-detail/C2930266.html
16,C2907315,FRC0805J202 TS,FOJAN,805,,2kΩ ±5% 125mW 0805 Thick Film Resistor,yes,100,100,100,0.0022,0.22,https://www.lcsc.com/product-detail/C2907315.html
,,,,,,,,,,,total:,28.59,
Mechanical ,,,price (USD),link,,,,,,,,,
PLA Filament,,1,7.36,https://www.aliexpress.us/item/3256806054300015.html?spm=a2g0o.productlist.main.3.6f78379d5OwR1X&algo_pvid=498c2f52-b8c2-4add-bea6-f9bda40c924e&algo_exp_id=498c2f52-b8c2-4add-bea6-f9bda40c924e-2&pdp_ext_f=%7B%22order%22%3A%22488%22%2C%22eval%22%3A%221%22%2C%22fromPage%22%3A%22search%22%7D&pdp_npi=6%40dis%21USD%2122.79%217.36%21%21%2122.79%217.36%21%402140c1c317807875296987000e9684%2112000058209259440%21sea%21US%210%21ABX%211%210%21n_tag%3A-29910%3Bd%3Ae1bbef76%3Bm03_new_user%3A-29895%3BpisId%3A5000000208023469&curPageLogUid=Qx4M7j8exyPx&utparam-url=scene%3Asearch%7Cquery_from%3A%7Cx_object_id%3A1005006240614767%7C_p_origin_prod%3A,,,,,,,,,
motors ,,4,30,https://precisionminidrives.com/product/shaft-diameter-8mm-10mm-micro-dc-gear-motor-model-nfp-42-775-ce-12v-24v?attribute_option=12V%2C+80RPM&attribute_shaft-diameter=10mm&utm_source=GoogleAds&utm_campaign=PMax&utm_medium=Google%20Shopping&utm_term=adtribes&utm_content=%7Bproduct_id%7D&gad_source=1&gad_campaignid=18478080173&gbraid=0AAAAAomY7RXK-6ddvY5v_P-wvX2-wvXLt&gclid=CjwKCAjw5NvPBhAoEiwA_2egfvITADIqACLw4gyQt7JJ5pv2qg0MlFNwTrXCpuVo1aJEWzca6XUyrBoCjcwQAvD_BwE,,,,,,,,,
RU-28,,4,19.91,https://www.aliexpress.us/item/3256809392312866.html?src=google&src=google&albch=shopping&acnt=708-803-3821&isdl=y&slnk=&plac=&mtctp=&albbt=Google_7_shopping&aff_platform=google&aff_short_key=UneMJZVf&gclsrc=aw.ds&albagn=888888&ds_e_adid=&ds_e_matchtype=&ds_e_device=c&ds_e_network=x&ds_e_product_group_id=&ds_e_product_id=en3256809392312866&ds_e_product_merchant_id=107675220&ds_e_product_country=US&ds_e_product_language=en&ds_e_product_channel=online&ds_e_product_store_id=&ds_url_v=2&albcp=20123152476&albag=&isSmbAutoCall=false&needSmbHouyi=false&gad_source=1&gad_campaignid=20127768206&gbraid=0AAAAAD6I-hH5MzbM-Qht5WI26YJI1jQ7x&gclid=CjwKCAjw5NvPBhAoEiwA_2egfknGl0bGc7tc0ydw4pmODKzmqiRzPcj2s5EQ8m0HpaPSL7tY9xceahoCLmEQAvD_BwE&gatewayAdapt=glo2usa,,,,,,,,,
M5 Screws (x50),,1,15,https://www.amazon.co.jp/-/en/Button-Socket-Screws-Finish-BHSSM5X10B-50-SL/dp/B07DZN3FP5,,,,,,,,,
M3 screws and nuts (x20),,1,9,https://www.amazon.co.jp/-/en/Phillips-Machine-Washers-Plastic-Countersunk/dp/B0B9YGNKV6,,,,,,,,,
m5 nuts (x50),,1,13,https://www.amazon.co.jp/-/en/Thin-Nuts-Stainless-Steel-Flat/dp/B0CQ55XWQX?th=1,,,,,,,,,
,,Total:,244,,,,,,,,,,

README.md

# Electronics BOM table

add_subheading("Electronics", size=14)
electronics_headers = ["Index", "LCSC #", "Quantity", "Value", "Link"]
electronics_rows = [
["1", "C146170", "2", "1.81", ("hyperlink", "LCSC", "https://www.lcsc.com/product-detail/C146170.html")],
["2", "C22396880", "6", "10.34", ("hyperlink", "LCSC", "https://www.lcsc.com/product-detail/C22396880.html")],
["3", "C49678", "100", "0.84", ("hyperlink", "LCSC", "https://www.lcsc.com/product-detail/C49678.html")],
["4", "C72487", "20", "0.57", ("hyperlink", "LCSC", "https://www.lcsc.com/product-detail/C72487.html")],
["5", "C24123", "20", "0.30", ("hyperlink", "LCSC", "https://www.lcsc.com/product-detail/C24123.html")],
["6", "C3869051", "20", "0.57", ("hyperlink", "LCSC", "https://www.lcsc.com/product-detail/C3869051.html")],
["7", "C8465", "5", "0.67", ("hyperlink", "LCSC", "https://www.lcsc.com/product-detail/C8465.html")],
["8", "C72334", "5", "1.01", ("hyperlink", "LCSC", "https://www.lcsc.com/product-detail/C72334.html")],
["9", "C86513", "4", "6.79", ("hyperlink", "LCSC", "https://www.lcsc.com/product-detail/C86513.html")],
["10", "C114548", "100", "0.36", ("hyperlink", "LCSC", "https://www.lcsc.com/product-detail/C114548.html")],
["11", "C2930231", "100", "0.19", ("hyperlink", "LCSC", "https://www.lcsc.com/product-detail/C2930231.html")],
["12", "C90964", "5", "3.70", ("hyperlink", "LCSC", "https://www.lcsc.com/product-detail/C90964.html")],
["13", "C58159", "1", "0.38", ("hyperlink", "LCSC", "https://www.lcsc.com/product-detail/C58159.html")],
["14", "C7467397", "50", "0.65", ("hyperlink", "LCSC", "https://www.lcsc.com/product-detail/C7467397.html")],
["15", "C2930266", "100", "0.19", ("hyperlink", "LCSC", "https://www.lcsc.com/product-detail/C2930266.html")],
["16", "C2907315", "100", "0.22", ("hyperlink", "LCSC", "https://www.lcsc.com/product-detail/C2907315.html")],
["", "", "Total:", "28.59", ""],
]
add_table(electronics_headers, electronics_rows, font_size=8)

# Mechanical BOM table

add_subheading("Mechanical", size=14)
mechanical_headers = ["Part name", "Quantity", "Value", "Link"]
mechanical_rows = [
["PLA Filament", "1", "7.36", ("hyperlink", "AliExpress", "https://www.aliexpress.us/item/3256806054300015.html?spm=a2g0o.productlist.main.3.6f78379d5OwR1X&algo_pvid=498c2f52-b8c2-4add-bea6-f9bda40c924e&algo_exp_id=498c2f52-b8c2-4add-bea6-f9bda40c924e-2&pdp_ext_f=%7B%22order%22%3A%22488%22%2C%22eval%22%3A%221%22%2C%22fromPage%22%3A%22search%22%7D&pdp_npi=6%40dis%21USD%2122.79%217.36%21%21%2122.79%217.36%21%402140c1c317807875296987000e9684%2112000058209259440%21sea%21US%210%21ABX%211%210%21n_tag%3A-29910%3Bd%3Ae1bbef76%3Bm03_new_user%3A-29895%3BpisId%3A5000000208023469&curPageLogUid=Qx4M7j8exyPx&utparam-url=scene%3Asearch%7Cquery_from%3A%7Cx_object_id%3A1005006240614767%7C_p_origin_prod%3A")],
["motors", "4", "30", ("hyperlink", "Precision Mini Drives", "https://precisionminidrives.com/product/shaft-diameter-8mm-10mm-micro-dc-gear-motor-model-nfp-42-775-ce-12v-24v?attribute_option=12V%2C+80RPM&attribute_shaft-diameter=10mm&utm_source=GoogleAds&utm_campaign=PMax&utm_medium=Google%20Shopping&utm_term=adtribes&utm_content=%7Bproduct_id%7D&gad_source=1&gad_campaignid=18478080173&gbraid=0AAAAAomY7RXK-6ddvY5v_P-wvX2-wvXLt&gclid=CjwKCAjw5NvPBhAoEiwA_2egfvITADIqACLw4gyQt7JJ5pv2qg0MlFNwTrXCpuVo1aJEWzca6XUyrBoCjcwQAvD_BwE")],
["RU-28", "4", "19.91", ("hyperlink", "AliExpress", "https://www.aliexpress.us/item/3256809392312866.html?src=google&src=google&albch=shopping&acnt=708-803-3821&isdl=y&slnk=&plac=&mtctp=&albbt=Google_7_shopping&aff_platform=google&aff_short_key=UneMJZVf&gclsrc=aw.ds&albagn=888888&ds_e_adid=&ds_e_matchtype=&ds_e_device=c&ds_e_network=x&ds_e_product_group_id=&ds_e_product_id=en3256809392312866&ds_e_product_merchant_id=107675220&ds_e_product_country=US&ds_e_product_language=en&ds_e_product_channel=online&ds_e_product_store_id=&ds_url_v=2&albcp=20123152476&albag=&isSmbAutoCall=false&needSmbHouyi=false&gad_source=1&gad_campaignid=20127768206&gbraid=0AAAAAD6I-hH5MzbM-Qht5WI26YJI1jQ7x&gclid=CjwKCAjw5NvPBhAoEiwA_2egfknGl0bGc7tc0ydw4pmODKzmqiRzPcj2s5EQ8m0HpaPSL7tY9xceahoCLmEQAvD_BwE&gatewayAdapt=glo2usa")],
["M5 Screws (x50)", "1", "15", ("hyperlink", "Amazon Japan", "https://www.amazon.co.jp/-/en/Button-Socket-Screws-Finish-BHSSM5X10B-50-SL/dp/B07DZN3FP5")],
["M3 screws and nuts (x20)", "1", "9", ("hyperlink", "Amazon Japan", "https://www.amazon.co.jp/-/en/Phillips-Machine-Washers-Plastic-Countersunk/dp/B0B9YGNKV6")],
["m5 nuts (x50)", "1", "13", ("hyperlink", "Amazon Japan", "https://www.amazon.co.jp/-/en/Thin-Nuts-Stainless-Steel-Flat/dp/B0CQ55XWQX?th=1")],
["", "", "Total:", "244", ""],
]
add_table(mechanical_headers, mechanical_rows, font_size=8)
add_para("Total project cost: 272.59", bold=True)
doc.add_paragraph()